{
  "schema_version": "doctriage_bundle.v1",
  "title": "Architecture Thinking Bundle",
  "generated_at": "2026-05-01T00:00:00+00:00",
  "source": {
    "source_dir": "D:\\example_docs",
    "output_root": "D:\\doctriage_runs\\real_run_plan",
    "decisions_path": "D:\\doctriage_runs\\real_run_plan\\_state\\decisions.jsonl",
    "relations_path": "D:\\doctriage_runs\\real_run_plan\\_relationships\\relations.jsonl"
  },
  "selection_policy": {
    "min_quality": 80,
    "categories": [
      "Architecture",
      "Thinking",
      "Series"
    ],
    "limit": 50,
    "prefer_target_path": false,
    "include_summaries": true
  },
  "statistics": {
    "document_count": 2,
    "relation_count": 1,
    "category_counts": {
      "Architecture": 1,
      "Thinking": 1
    }
  },
  "documents": [
    {
      "id": "doc-example-001",
      "source_path": "D:\\example_docs\\architecture-review.pdf",
      "target_path": "",
      "preferred_path": "D:\\example_docs\\architecture-review.pdf",
      "relative_path": "architecture-review.pdf",
      "title": "architecture-review",
      "category": "Architecture",
      "quality": 92,
      "knowledge_density": 90,
      "implementation_specificity": 82,
      "logical_structure": 88,
      "reason": "Concrete architecture review with trade-off discussion.",
      "summary": "Optional local summary generated by DocTriage.",
      "status": "planned",
      "media_type": "application/pdf"
    },
    {
      "id": "doc-example-002",
      "source_path": "D:\\example_docs\\engineering-retrospective.md",
      "target_path": "",
      "preferred_path": "D:\\example_docs\\engineering-retrospective.md",
      "relative_path": "engineering-retrospective.md",
      "title": "engineering-retrospective",
      "category": "Thinking",
      "quality": 88,
      "knowledge_density": 86,
      "implementation_specificity": 70,
      "logical_structure": 84,
      "reason": "Useful retrospective with reusable engineering lessons.",
      "summary": "Optional local summary generated by DocTriage.",
      "status": "planned",
      "media_type": "text/markdown"
    }
  ],
  "relations": [
    {
      "left_relative_path": "architecture-review.pdf",
      "right_relative_path": "engineering-retrospective.md",
      "relation_score": 0.82,
      "signals": [
        "category",
        "path"
      ],
      "filename_similarity": 0.44,
      "time_proximity": 0.73,
      "path_proximity": 1.0,
      "embedding_similarity": 0.0,
      "citation_count": 1
    }
  ]
}
